<?xml version="1.0" encoding="UTF-8"?>
<mmlBc:BaseClinicModule
  xmlns:mmlBc="http://www.medxml.net/MML/v4/ContentModule/BaseClinic/1.0"
  xmlns:xsi="http://www.w3.org/2001/XMLSchema-instance"
  xsi:schemaLocation="http://www.medxml.net/MML/v4/ContentModule/BaseClinic/1.0/baseclinic.xsd"
  xmlns:xhtml="http://www.w3.org/1999/xhtml">
  <mmlBc:allergy>
    <mmlBc:allergyItem>
      <mmlBc:factor>crab</mmlBc:factor>
      <mmlBc:severity>mild</mmlBc:severity>
      <mmlBc:identifiedDate>since almost 20 years ago</mmlBc:identifiedDate>
      <mmlBc:memo>no reaction to shrimp</mmlBc:memo>
    </mmlBc:allergyItem>
  </mmlBc:allergy>
  <mmlBc:bloodtype>
    <mmlBc:abo>a</mmlBc:abo>
    <mmlBc:rh>rhD+</mmlBc:rh>
  </mmlBc:bloodtype>
 </mmlBc:BaseClinicModule>
